<?xml version="1.0" encoding="UTF-8"?>
<xs:schema xmlns:xs="http://www.w3.org/2001/XMLSchema" elementFormDefault="qualified">

    <xs:element name="portfolio">
        <xs:complexType>
            <xs:sequence>
                <xs:element ref="header"/>
                <xs:element ref="garden_profile"/>
                <xs:element ref="abilities"/>
                <xs:element ref="hobbies"/>
                <xs:element ref="education"/>
            </xs:sequence>
        </xs:complexType>
    </xs:element>

    <xs:element name="header">
        <xs:complexType>
            <xs:sequence>
                <xs:element name="contact">
                    <xs:complexType>
                        <xs:sequence>
                            <xs:element name="location" type="xs:string"/>
                            <xs:element name="phone" type="xs:string"/>
                            <xs:element name="email" type="xs:string"/>
                        </xs:sequence>
                    </xs:complexType>
                </xs:element>
            </xs:sequence>
            <xs:attribute name="name" type="xs:string" use="required"/>
            <xs:attribute name="title" type="xs:string" use="optional"/>
        </xs:complexType>
    </xs:element>

    <xs:element name="garden_profile">
        <xs:complexType>
            <xs:sequence>
                <xs:element name="info" maxOccurs="unbounded">
                    <xs:complexType>
                        <xs:simpleContent>
                            <xs:extension base="xs:string">
                                <xs:attribute name="key" type="xs:string" use="required"/>
                            </xs:extension>
                        </xs:simpleContent>
                    </xs:complexType>
                </xs:element>
            </xs:sequence>
            <xs:attribute name="level" type="xs:integer" use="required"/>
        </xs:complexType>
    </xs:element>

    <xs:element name="abilities">
        <xs:complexType>
            <xs:sequence>
                <xs:element name="section" maxOccurs="unbounded">
                    <xs:complexType>
                        <xs:sequence>
                            <xs:element name="ability" type="xs:string" maxOccurs="unbounded"/>
                        </xs:sequence>
                        <xs:attribute name="title" type="xs:string" use="required"/>
                    </xs:complexType>
                </xs:element>
            </xs:sequence>
        </xs:complexType>
    </xs:element>

    <xs:element name="hobbies">
        <xs:complexType>
            <xs:sequence>
                <xs:element name="activity" type="xs:string" maxOccurs="unbounded"/>
            </xs:sequence>
            <xs:attribute name="title" type="xs:string" use="required"/>
        </xs:complexType>
    </xs:element>

    <xs:element name="education">
        <xs:complexType>
            <xs:sequence>
                <xs:element name="period" maxOccurs="unbounded">
                    <xs:complexType>
                        <xs:sequence>
                            <xs:element name="school">
                                <xs:complexType>
                                    <xs:attribute name="name" type="xs:string" use="required"/>
                                    <xs:attribute name="location" type="xs:string" use="required"/>
                                </xs:complexType>
                            </xs:element>
                        </xs:sequence>
                        <xs:attribute name="year_start" type="xs:string" use="required"/>
                        <xs:attribute name="year_end" type="xs:string" use="required"/>
                        <xs:attribute name="type" type="xs:string" use="required"/>
                    </xs:complexType>
                </xs:element>
            </xs:sequence>
            <xs:attribute name="title" type="xs:string" use="required"/>
        </xs:complexType>
    </xs:element>

</xs:schema>